{
  "book_id": "usr-4feb0ab87a05",
  "user_id": "kris",
  "active_set_id": "default",
  "sets": [
    {
      "set_id": "default",
      "kind": "default",
      "label": "Default",
      "status": "ready"
    },
    {
      "set_id": "set-0a1b2c3d4e5f",
      "kind": "style",
      "label": "Watercolour",
      "style_id": "watercolour",
      "source_revision": 1,
      "status": "ready",
      "created": "2026-07-15T02:00:00Z"
    }
  ]
}
